{
  "friction_payload_id": "c3c3c3c3-c3c3-4cc3-8cc3-c3c3c3c3c3c3",
  "correlation_id": "66666666-6666-4666-8666-666666666666",
  "request_id": "55555555-5555-4555-8555-555555555555",
  "friction_kind": "explicit_approval_required",
  "operator_action": "approve_or_decline",
  "route_decision_id": "77777777-7777-4777-8777-777777777773",
  "execution_plan_id": "99999999-9999-4999-8999-999999999999",
  "stable_plan_hash": "a8f7e75a4a4ea309803cf16fec43a4adb788ddcaa5589d91a9c00a41a8f56df7",
  "review_package_id": "abababab-abab-4bab-8bab-abababababab",
  "forensic_event_id": "f1f1f1f1-f1f1-4ff1-8ff1-f1f1f1f1f1f1",
  "current_posture": "explicit_operator_approval",
  "execution_state": "waiting_explicit_approval",
  "degraded_subtype": null,
  "denial_guards": [],
  "operator_visible_summary": "explicit operator approval is required before execution may begin",
  "payload_minimized": true,
  "created_at_utc": "2030-01-01T00:09:31Z"
}
